{
  "schemaVersion": 1,
  "runtimeId": "ubuntu-24.04-arm64-deepseek-harness",
  "version": "0.2.3-mobile-323",
  "dshVersion": "0.2.0-rc.2",
  "architecture": "arm64-v8a",
  "rootfs": {
    "url": "https://github.com/dphmoblie/deepseek-harness-android/releases/download/v0.2.3-mobile-323/rootfs.bundle",
    "sha256": "1b87a4e0bfc38e20caee22e4affbf2de1f4a11d441c8034e236ae2e9e0c6f173",
    "compressedBytes": 311715836,
    "extractedBytes": 1006331281,
    "compression": "gzip"
  },
  "entrypoints": {
    "shell": [
      "/bin/bash",
      "--login"
    ],
    "harness": [
      "/usr/local/bin/dsh",
      "web",
      "--host",
      "127.0.0.1",
      "--port",
      "3080"
    ]
  },
  "harnessUrl": "http://127.0.0.1:3080/",
  "profileLinks": 515,
  "mobile": {
    "dsh": {
      "profile": {
        "bundles": [
          "@deepseek-ai/dsh-base",
          "@deepseek-ai/dsh-web-app",
          "@deepseek-harness/dsh-mobile-shizuku"
        ]
      }
    },
    "mobile": {
      "idleStopMinutes": 15,
      "embedRootfs": false
    }
  }
}
